{
  "schema_version": "1.0",
  "run_id": "run_01",
  "status": "timed_out",
  "seed": 1001,
  "started_at_utc": "2026-10-10T07:42:07.9274700Z",
  "completed_at_utc": "2026-10-10T07:47:09.9884296Z",
  "repository": {
    "root": "C:\\Users\\grigo\\Documents\\Paradox Interactive\\Europa Universalis IV\\mod\\RIP",
    "head": "b3e07f7376df697f96870ea4effcf3d36d95a1e3",
    "dirty": true,
    "status_lines": [
      " M common/custom_gui/RIP_church_controls.txt",
      " M common/scripted_effects/russian_orthodox_effects.txt",
      " M common/scripted_triggers/rip_church_propagation_triggers.txt",
      " M common/trading_policies/RIP_church_mission_network.txt",
      " M customizable_localization/rip_church_redesign.txt",
      " M diagnostics/church_redesign_20260911/ro_policy_icon.png",
      " M events/RussianOrthodox.txt",
      " M gfx/interface/rip_ro_mission_policy.dds",
      " M interface/RIP_church_panels.gfx",
      " M interface/countryreligionview.gui",
      " M localisation/replace/zzz_RIP_l_english.yml",
      " M localisation/replace/zzzz_RIP_church_redesign_l_english.yml",
      " M localisation/replace/zzzz_RIP_church_redesign_l_french.yml",
      " M localisation/replace/zzzz_RIP_church_redesign_l_german.yml",
      " M localisation/replace/zzzz_RIP_church_redesign_l_spanish.yml",
      " M localisation/zzz_force_localisation_l_english.yml",
      " M missions/Volhynia_Missions.txt",
      " M tests/run_all_tests.py",
      " M tools/build_church_gui.py",
      " M tools/build_church_localisation.py",
      " M tools/build_ro_policy_icon.py",
      " M tools/preview_church_tabs.py",
      "?? diagnostics/church_ux_20261010/layout.json",
      "?? diagnostics/church_ux_20261010/profile/dlc_load.json",
      "?? diagnostics/church_ux_20261010/profile/mod/RIP.mod",
      "?? diagnostics/church_ux_20261010/profile/settings.txt",
      "?? diagnostics/church_ux_20261010/ro.png",
      "?? diagnostics/church_ux_20261010/tabs.png",
      "?? docs/RUSSIAN_ORTHODOX_TRADE_MISSIONS.md",
      "?? tests/check_ro_policy_ui.py",
      "?? tests/check_ro_trade_policy.py",
      "?? tests/check_turov_name.py"
    ],
    "source_snapshot": "C:\\Users\\grigo\\Documents\\Paradox Interactive\\Europa Universalis IV\\mod\\RIP\\diagnostics\\church_ux_20261010\\observer_runs\\smoke_20261010_074155Z\\source_snapshot",
    "source_inventory": "C:\\Users\\grigo\\Documents\\Paradox Interactive\\Europa Universalis IV\\mod\\RIP\\diagnostics\\church_ux_20261010\\observer_runs\\smoke_20261010_074155Z\\source-inventory.json",
    "source_inventory_sha256": "7B10C70E2494A767BA190ADE6426AB38D7952DD0BE1530773BB17D1CB7736B6A",
    "source_file_count": 785
  },
  "game": {
    "executable": "C:\\Program Files (x86)\\Steam\\steamapps\\common\\Europa Universalis IV\\eu4.exe",
    "version": "v1.37.5.0",
    "supported_version": "v1.37.5.0",
    "bootstrap_mode": "AutoRun",
    "no_gui": true,
    "smoke": true,
    "command_file": "rip_observer_commands_20261010_074155161Z_smoke_setup.txt",
    "arguments": [
      "-debug_mode",
      "-start_tag=KIE",
      "-seed=1001",
      "-userdir=\"C:\\Users\\grigo\\Documents\\Paradox Interactive\\Europa Universalis IV\\mod\\RIP\\diagnostics\\church_ux_20261010\\profile\"",
      "-auto_run=rip_observer_commands_20261010_074155161Z_smoke_setup.txt"
    ]
  },
  "user_data_root": "C:\\Users\\grigo\\Documents\\Paradox Interactive\\Europa Universalis IV\\mod\\RIP\\diagnostics\\church_ux_20261010\\profile",
  "completion": {
    "target_year": 1446,
    "detected_save": null,
    "detected_date": null,
    "process_exit_code": null,
    "forced_stop": false
  },
  "artifacts": {
    "saves": [],
    "logs": [
      "C:\\Users\\grigo\\Documents\\Paradox Interactive\\Europa Universalis IV\\mod\\RIP\\diagnostics\\church_ux_20261010\\observer_runs\\smoke_20261010_074155Z\\run_01\\logs\\ai_budget_allocation.csv",
      "C:\\Users\\grigo\\Documents\\Paradox Interactive\\Europa Universalis IV\\mod\\RIP\\diagnostics\\church_ux_20261010\\observer_runs\\smoke_20261010_074155Z\\run_01\\logs\\ai_budgeting.log",
      "C:\\Users\\grigo\\Documents\\Paradox Interactive\\Europa Universalis IV\\mod\\RIP\\diagnostics\\church_ux_20261010\\observer_runs\\smoke_20261010_074155Z\\run_01\\logs\\ai_priority.log",
      "C:\\Users\\grigo\\Documents\\Paradox Interactive\\Europa Universalis IV\\mod\\RIP\\diagnostics\\church_ux_20261010\\observer_runs\\smoke_20261010_074155Z\\run_01\\logs\\ai_spending.log",
      "C:\\Users\\grigo\\Documents\\Paradox Interactive\\Europa Universalis IV\\mod\\RIP\\diagnostics\\church_ux_20261010\\observer_runs\\smoke_20261010_074155Z\\run_01\\logs\\ai.log",
      "C:\\Users\\grigo\\Documents\\Paradox Interactive\\Europa Universalis IV\\mod\\RIP\\diagnostics\\church_ux_20261010\\observer_runs\\smoke_20261010_074155Z\\run_01\\logs\\autotest.log",
      "C:\\Users\\grigo\\Documents\\Paradox Interactive\\Europa Universalis IV\\mod\\RIP\\diagnostics\\church_ux_20261010\\observer_runs\\smoke_20261010_074155Z\\run_01\\logs\\building_investment.log",
      "C:\\Users\\grigo\\Documents\\Paradox Interactive\\Europa Universalis IV\\mod\\RIP\\diagnostics\\church_ux_20261010\\observer_runs\\smoke_20261010_074155Z\\run_01\\logs\\code_revisions.log",
      "C:\\Users\\grigo\\Documents\\Paradox Interactive\\Europa Universalis IV\\mod\\RIP\\diagnostics\\church_ux_20261010\\observer_runs\\smoke_20261010_074155Z\\run_01\\logs\\custom_automated_stats.log",
      "C:\\Users\\grigo\\Documents\\Paradox Interactive\\Europa Universalis IV\\mod\\RIP\\diagnostics\\church_ux_20261010\\observer_runs\\smoke_20261010_074155Z\\run_01\\logs\\error.log",
      "C:\\Users\\grigo\\Documents\\Paradox Interactive\\Europa Universalis IV\\mod\\RIP\\diagnostics\\church_ux_20261010\\observer_runs\\smoke_20261010_074155Z\\run_01\\logs\\game.log",
      "C:\\Users\\grigo\\Documents\\Paradox Interactive\\Europa Universalis IV\\mod\\RIP\\diagnostics\\church_ux_20261010\\observer_runs\\smoke_20261010_074155Z\\run_01\\logs\\graphics.log",
      "C:\\Users\\grigo\\Documents\\Paradox Interactive\\Europa Universalis IV\\mod\\RIP\\diagnostics\\church_ux_20261010\\observer_runs\\smoke_20261010_074155Z\\run_01\\logs\\income_expenses.csv",
      "C:\\Users\\grigo\\Documents\\Paradox Interactive\\Europa Universalis IV\\mod\\RIP\\diagnostics\\church_ux_20261010\\observer_runs\\smoke_20261010_074155Z\\run_01\\logs\\local_temp.log",
      "C:\\Users\\grigo\\Documents\\Paradox Interactive\\Europa Universalis IV\\mod\\RIP\\diagnostics\\church_ux_20261010\\observer_runs\\smoke_20261010_074155Z\\run_01\\logs\\memory.log",
      "C:\\Users\\grigo\\Documents\\Paradox Interactive\\Europa Universalis IV\\mod\\RIP\\diagnostics\\church_ux_20261010\\observer_runs\\smoke_20261010_074155Z\\run_01\\logs\\message.log",
      "C:\\Users\\grigo\\Documents\\Paradox Interactive\\Europa Universalis IV\\mod\\RIP\\diagnostics\\church_ux_20261010\\observer_runs\\smoke_20261010_074155Z\\run_01\\logs\\profiling_functions.csv",
      "C:\\Users\\grigo\\Documents\\Paradox Interactive\\Europa Universalis IV\\mod\\RIP\\diagnostics\\church_ux_20261010\\observer_runs\\smoke_20261010_074155Z\\run_01\\logs\\profiling.log",
      "C:\\Users\\grigo\\Documents\\Paradox Interactive\\Europa Universalis IV\\mod\\RIP\\diagnostics\\church_ux_20261010\\observer_runs\\smoke_20261010_074155Z\\run_01\\logs\\profiling.xml",
      "C:\\Users\\grigo\\Documents\\Paradox Interactive\\Europa Universalis IV\\mod\\RIP\\diagnostics\\church_ux_20261010\\observer_runs\\smoke_20261010_074155Z\\run_01\\logs\\random.log",
      "C:\\Users\\grigo\\Documents\\Paradox Interactive\\Europa Universalis IV\\mod\\RIP\\diagnostics\\church_ux_20261010\\observer_runs\\smoke_20261010_074155Z\\run_01\\logs\\random02.log",
      "C:\\Users\\grigo\\Documents\\Paradox Interactive\\Europa Universalis IV\\mod\\RIP\\diagnostics\\church_ux_20261010\\observer_runs\\smoke_20261010_074155Z\\run_01\\logs\\receivedcommands.log",
      "C:\\Users\\grigo\\Documents\\Paradox Interactive\\Europa Universalis IV\\mod\\RIP\\diagnostics\\church_ux_20261010\\observer_runs\\smoke_20261010_074155Z\\run_01\\logs\\sentcommands.log",
      "C:\\Users\\grigo\\Documents\\Paradox Interactive\\Europa Universalis IV\\mod\\RIP\\diagnostics\\church_ux_20261010\\observer_runs\\smoke_20261010_074155Z\\run_01\\logs\\setup_error.log",
      "C:\\Users\\grigo\\Documents\\Paradox Interactive\\Europa Universalis IV\\mod\\RIP\\diagnostics\\church_ux_20261010\\observer_runs\\smoke_20261010_074155Z\\run_01\\logs\\setup.log",
      "C:\\Users\\grigo\\Documents\\Paradox Interactive\\Europa Universalis IV\\mod\\RIP\\diagnostics\\church_ux_20261010\\observer_runs\\smoke_20261010_074155Z\\run_01\\logs\\system_interface.log",
      "C:\\Users\\grigo\\Documents\\Paradox Interactive\\Europa Universalis IV\\mod\\RIP\\diagnostics\\church_ux_20261010\\observer_runs\\smoke_20261010_074155Z\\run_01\\logs\\system.log",
      "C:\\Users\\grigo\\Documents\\Paradox Interactive\\Europa Universalis IV\\mod\\RIP\\diagnostics\\church_ux_20261010\\observer_runs\\smoke_20261010_074155Z\\run_01\\logs\\text.log",
      "C:\\Users\\grigo\\Documents\\Paradox Interactive\\Europa Universalis IV\\mod\\RIP\\diagnostics\\church_ux_20261010\\observer_runs\\smoke_20261010_074155Z\\run_01\\logs\\time.log"
    ],
    "configuration": [
      "C:\\Users\\grigo\\Documents\\Paradox Interactive\\Europa Universalis IV\\mod\\RIP\\diagnostics\\church_ux_20261010\\observer_runs\\smoke_20261010_074155Z\\run_01\\configuration\\dlc_load.json",
      "C:\\Users\\grigo\\Documents\\Paradox Interactive\\Europa Universalis IV\\mod\\RIP\\diagnostics\\church_ux_20261010\\observer_runs\\smoke_20261010_074155Z\\run_01\\configuration\\settings.txt",
      "C:\\Users\\grigo\\Documents\\Paradox Interactive\\Europa Universalis IV\\mod\\RIP\\diagnostics\\church_ux_20261010\\observer_runs\\smoke_20261010_074155Z\\run_01\\configuration\\RIP.mod",